<?xml version="1.0"?>
<!DOCTYPE eLinkResult PUBLIC "-//NLM//DTD eLinkResult, 23 November 2010//EN" "http://www.ncbi.nlm.nih.gov/entrez/query/DTD/eLink_101123.dtd">
<eLinkResult>

	<LinkSet>
		<DbFrom>pubmed</DbFrom>
		<IdList>
			<Id>9298984</Id>
		</IdList>
		<LinkSetDb>
			<DbTo>pubmed</DbTo>
			<LinkName>pubmed_pubmed</LinkName>
			<Link>
				<Id>9298984</Id>
			</Link>
			<Link>
				<Id>8794856</Id>
			</Link>
			<Link>
				<Id>9700164</Id>
			</Link>
			<Link>
				<Id>7914521</Id>
			</Link>
			<Link>
				<Id>9914369</Id>
			</Link>
			<Link>
				<Id>1339459</Id>
			</Link>
			<Link>
				<Id>11590237</Id>
			</Link>
			<Link>
				<Id>12686595</Id>
			</Link>
			<Link>
				<Id>20980244</Id>
			</Link>
			<Link>
				<Id>11146659</Id>
			</Link>
			<Link>
				<Id>8978614</Id>
			</Link>
			<Link>
				<Id>9074495</Id>
			</Link>
			<Link>
				<Id>10893249</Id>
			</Link>
			<Link>
				<Id>2211822</Id>
			</Link>
			<Link>
				<Id>15371539</Id>
			</Link>
			<Link>
				<Id>10402457</Id>
			</Link>
			<Link>
				<Id>10806105</Id>
			</Link>
			<Link>
				<Id>10545493</Id>
			</Link>
			<Link>
				<Id>15915585</Id>
			</Link>
			<Link>
				<Id>10523511</Id>
			</Link>
			<Link>
				<Id>12515822</Id>
			</Link>
			<Link>
				<Id>9869638</Id>
			</Link>
			<Link>
				<Id>11483958</Id>
			</Link>
			<Link>
				<Id>11685532</Id>
			</Link>
			<Link>
				<Id>9490715</Id>
			</Link>
			<Link>
				<Id>1691829</Id>
			</Link>
			<Link>
				<Id>9425896</Id>
			</Link>
			<Link>
				<Id>12080088</Id>
			</Link>
			<Link>
				<Id>12034769</Id>
			</Link>
			<Link>
				<Id>9852156</Id>
			</Link>
			<Link>
				<Id>8923204</Id>
			</Link>
			<Link>
				<Id>7690762</Id>
			</Link>
			<Link>
				<Id>17895365</Id>
			</Link>
			<Link>
				<Id>9378750</Id>
			</Link>
			<Link>
				<Id>11146661</Id>
			</Link>
			<Link>
				<Id>18202360</Id>
			</Link>
			<Link>
				<Id>10985388</Id>
			</Link>
			<Link>
				<Id>11266459</Id>
			</Link>
			<Link>
				<Id>2022189</Id>
			</Link>
			<Link>
				<Id>8056842</Id>
			</Link>
			<Link>
				<Id>11914278</Id>
			</Link>
			<Link>
				<Id>15616189</Id>
			</Link>
			<Link>
				<Id>18936247</Id>
			</Link>
			<Link>
				<Id>17222555</Id>
			</Link>
			<Link>
				<Id>7585942</Id>
			</Link>
			<Link>
				<Id>9735366</Id>
			</Link>
			<Link>
				<Id>11179694</Id>
			</Link>
			<Link>
				<Id>21118145</Id>
			</Link>
			<Link>
				<Id>16732327</Id>
			</Link>
			<Link>
				<Id>14522947</Id>
			</Link>
			<Link>
				<Id>11352945</Id>
			</Link>
			<Link>
				<Id>16839185</Id>
			</Link>
			<Link>
				<Id>11267866</Id>
			</Link>
			<Link>
				<Id>10898791</Id>
			</Link>
			<Link>
				<Id>12388768</Id>
			</Link>
			<Link>
				<Id>16741559</Id>
			</Link>
			<Link>
				<Id>11252055</Id>
			</Link>
			<Link>
				<Id>7904902</Id>
			</Link>
			<Link>
				<Id>17182852</Id>
			</Link>
			<Link>
				<Id>9606208</Id>
			</Link>
			<Link>
				<Id>15268859</Id>
			</Link>
			<Link>
				<Id>18460473</Id>
			</Link>
			<Link>
				<Id>11266451</Id>
			</Link>
			<Link>
				<Id>10398680</Id>
			</Link>
			<Link>
				<Id>16516834</Id>
			</Link>
			<Link>
				<Id>12235289</Id>
			</Link>
			<Link>
				<Id>16585270</Id>
			</Link>
			<Link>
				<Id>1541637</Id>
			</Link>
			<Link>
				<Id>18923084</Id>
			</Link>
			<Link>
				<Id>16510521</Id>
			</Link>
			<Link>
				<Id>8175879</Id>
			</Link>
			<Link>
				<Id>11715021</Id>
			</Link>
			<Link>
				<Id>8548823</Id>
			</Link>
			<Link>
				<Id>15485811</Id>
			</Link>
			<Link>
				<Id>11092768</Id>
			</Link>
			<Link>
				<Id>7790358</Id>
			</Link>
			<Link>
				<Id>11102811</Id>
			</Link>
			<Link>
				<Id>15824131</Id>
			</Link>
			<Link>
				<Id>16802858</Id>
			</Link>
			<Link>
				<Id>17333235</Id>
			</Link>
			<Link>
				<Id>9258677</Id>
			</Link>
			<Link>
				<Id>17525528</Id>
			</Link>
			<Link>
				<Id>9396743</Id>
			</Link>
			<Link>
				<Id>12514103</Id>
			</Link>
			<Link>
				<Id>16219694</Id>
			</Link>
			<Link>
				<Id>10428958</Id>
			</Link>
			<Link>
				<Id>14699129</Id>
			</Link>
			<Link>
				<Id>2211824</Id>
			</Link>
			<Link>
				<Id>11369198</Id>
			</Link>
			<Link>
				<Id>15075237</Id>
			</Link>
			<Link>
				<Id>14972679</Id>
			</Link>
			<Link>
				<Id>7730407</Id>
			</Link>
			<Link>
				<Id>9009204</Id>
			</Link>
			<Link>
				<Id>11402064</Id>
			</Link>
			<Link>
				<Id>22685323</Id>
			</Link>
			<Link>
				<Id>24038651</Id>
			</Link>
			<Link>
				<Id>23746972</Id>
			</Link>
		</LinkSetDb>
		<LinkSetDb>
			<DbTo>pubmed</DbTo>
			<LinkName>pubmed_pubmed_alsoviewed</LinkName>
			<Link>
				<Id>9298984</Id>
			</Link>
		</LinkSetDb>
		<LinkSetDb>
			<DbTo>pubmed</DbTo>
			<LinkName>pubmed_pubmed_citedin</LinkName>
			<Link>
				<Id>20439434</Id>
			</Link>
			<Link>
				<Id>19273145</Id>
			</Link>
			<Link>
				<Id>19177000</Id>
			</Link>
			<Link>
				<Id>18936247</Id>
			</Link>
			<Link>
				<Id>18268100</Id>
			</Link>
			<Link>
				<Id>17699596</Id>
			</Link>
			<Link>
				<Id>16563186</Id>
			</Link>
			<Link>
				<Id>16505164</Id>
			</Link>
			<Link>
				<Id>16107559</Id>
			</Link>
			<Link>
				<Id>15824131</Id>
			</Link>
			<Link>
				<Id>15029241</Id>
			</Link>
			<Link>
				<Id>12686595</Id>
			</Link>
			<Link>
				<Id>11756470</Id>
			</Link>
			<Link>
				<Id>11553716</Id>
			</Link>
			<Link>
				<Id>11500386</Id>
			</Link>
			<Link>
				<Id>11402076</Id>
			</Link>
			<Link>
				<Id>11331754</Id>
			</Link>
			<Link>
				<Id>10545493</Id>
			</Link>
			<Link>
				<Id>10402457</Id>
			</Link>
			<Link>
				<Id>10402425</Id>
			</Link>
			<Link>
				<Id>9914368</Id>
			</Link>
			<Link>
				<Id>9763420</Id>
			</Link>
			<Link>
				<Id>9700166</Id>
			</Link>
			<Link>
				<Id>9700164</Id>
			</Link>
		</LinkSetDb>
		<LinkSetDb>
			<DbTo>pubmed</DbTo>
			<LinkName>pubmed_pubmed_combined</LinkName>
			<Link>
				<Id>9298984</Id>
			</Link>
			<Link>
				<Id>8794856</Id>
			</Link>
			<Link>
				<Id>9700164</Id>
			</Link>
			<Link>
				<Id>7914521</Id>
			</Link>
			<Link>
				<Id>9914369</Id>
			</Link>
			<Link>
				<Id>1339459</Id>
			</Link>
		</LinkSetDb>
		<LinkSetDb>
			<DbTo>pubmed</DbTo>
			<LinkName>pubmed_pubmed_five</LinkName>
			<Link>
				<Id>9298984</Id>
			</Link>
			<Link>
				<Id>8794856</Id>
			</Link>
			<Link>
				<Id>9700164</Id>
			</Link>
			<Link>
				<Id>7914521</Id>
			</Link>
			<Link>
				<Id>9914369</Id>
			</Link>
			<Link>
				<Id>1339459</Id>
			</Link>
		</LinkSetDb>
		<LinkSetDb>
			<DbTo>pubmed</DbTo>
			<LinkName>pubmed_pubmed_refs</LinkName>
			<Link>
				<Id>14732139</Id>
			</Link>
			<Link>
				<Id>8909532</Id>
			</Link>
			<Link>
				<Id>8898221</Id>
			</Link>
			<Link>
				<Id>8824189</Id>
			</Link>
			<Link>
				<Id>8824188</Id>
			</Link>
			<Link>
				<Id>8794856</Id>
			</Link>
			<Link>
				<Id>8763498</Id>
			</Link>
			<Link>
				<Id>8706132</Id>
			</Link>
			<Link>
				<Id>8706131</Id>
			</Link>
			<Link>
				<Id>8647893</Id>
			</Link>
			<Link>
				<Id>8617505</Id>
			</Link>
			<Link>
				<Id>8560259</Id>
			</Link>
			<Link>
				<Id>8521491</Id>
			</Link>
			<Link>
				<Id>8505381</Id>
			</Link>
			<Link>
				<Id>8485583</Id>
			</Link>
			<Link>
				<Id>8416984</Id>
			</Link>
			<Link>
				<Id>8267981</Id>
			</Link>
			<Link>
				<Id>8143084</Id>
			</Link>
			<Link>
				<Id>8023161</Id>
			</Link>
			<Link>
				<Id>8005447</Id>
			</Link>
			<Link>
				<Id>7914521</Id>
			</Link>
			<Link>
				<Id>7906398</Id>
			</Link>
			<Link>
				<Id>7860624</Id>
			</Link>
			<Link>
				<Id>7854443</Id>
			</Link>
			<Link>
				<Id>7854422</Id>
			</Link>
			<Link>
				<Id>7846151</Id>
			</Link>
			<Link>
				<Id>7821090</Id>
			</Link>
			<Link>
				<Id>7758115</Id>
			</Link>
			<Link>
				<Id>7739381</Id>
			</Link>
			<Link>
				<Id>7704412</Id>
			</Link>
			<Link>
				<Id>7698647</Id>
			</Link>
			<Link>
				<Id>7664339</Id>
			</Link>
			<Link>
				<Id>7642709</Id>
			</Link>
			<Link>
				<Id>7642708</Id>
			</Link>
			<Link>
				<Id>7579695</Id>
			</Link>
			<Link>
				<Id>7542657</Id>
			</Link>
			<Link>
				<Id>7502067</Id>
			</Link>
			<Link>
				<Id>7172865</Id>
			</Link>
			<Link>
				<Id>6966403</Id>
			</Link>
			<Link>
				<Id>6793236</Id>
			</Link>
			<Link>
				<Id>6684600</Id>
			</Link>
			<Link>
				<Id>3928429</Id>
			</Link>
			<Link>
				<Id>3670292</Id>
			</Link>
			<Link>
				<Id>2686123</Id>
			</Link>
			<Link>
				<Id>2683077</Id>
			</Link>
			<Link>
				<Id>2512302</Id>
			</Link>
			<Link>
				<Id>2498337</Id>
			</Link>
			<Link>
				<Id>2195725</Id>
			</Link>
			<Link>
				<Id>2185478</Id>
			</Link>
			<Link>
				<Id>2139718</Id>
			</Link>
			<Link>
				<Id>2139717</Id>
			</Link>
			<Link>
				<Id>2022189</Id>
			</Link>
			<Link>
				<Id>1999466</Id>
			</Link>
			<Link>
				<Id>1684022</Id>
			</Link>
			<Link>
				<Id>1406971</Id>
			</Link>
			<Link>
				<Id>1339459</Id>
			</Link>
		</LinkSetDb>
		<LinkSetDb>
			<DbTo>pubmed</DbTo>
			<LinkName>pubmed_pubmed_reviews</LinkName>
			<Link>
				<Id>9298984</Id>
			</Link>
		</LinkSetDb>
		<LinkSetDb>
			<DbTo>pubmed</DbTo>
			<LinkName>pubmed_pubmed_reviews_five</LinkName>
			<Link>
				<Id>9298984</Id>
			</Link>
		</LinkSetDb>
	</LinkSet>
</eLinkResult>
