<?xml version="1.0"?>
<!DOCTYPE eLinkResult PUBLIC "-//NLM//DTD eLinkResult, 23 November 2010//EN" "http://www.ncbi.nlm.nih.gov/entrez/query/DTD/eLink_101123.dtd">
<eLinkResult>
<LinkSet>
	<DbFrom>pubmed</DbFrom>
	<IdList>
		<Id>12242737</Id>
	</IdList>
	<LinkSetDb>
		<DbTo>pubmed</DbTo>
		<LinkName>pubmed_pubmed</LinkName>
		<Link>
			<Id>23255877</Id>
		</Link>
		<Link>
			<Id>22688104</Id>
		</Link>
		<Link>
			<Id>22661362</Id>
		</Link>
		<Link>
			<Id>22648258</Id>
		</Link>
		<Link>
			<Id>22521021</Id>
		</Link>
		<Link>
			<Id>22424988</Id>
		</Link>
		<Link>
			<Id>22369817</Id>
		</Link>
		<Link>
			<Id>22368911</Id>
		</Link>
		<Link>
			<Id>22194507</Id>
		</Link>
		<Link>
			<Id>22156652</Id>
		</Link>
		<Link>
			<Id>22109321</Id>
		</Link>
		<Link>
			<Id>21991829</Id>
		</Link>
		<Link>
			<Id>21984464</Id>
		</Link>
		<Link>
			<Id>21944608</Id>
		</Link>
		<Link>
			<Id>21908142</Id>
		</Link>
		<Link>
			<Id>21715237</Id>
		</Link>
		<Link>
			<Id>21694530</Id>
		</Link>
		<Link>
			<Id>21531047</Id>
		</Link>
		<Link>
			<Id>21153952</Id>
		</Link>
		<Link>
			<Id>21102533</Id>
		</Link>
		<Link>
			<Id>20860230</Id>
		</Link>
		<Link>
			<Id>20718377</Id>
		</Link>
		<Link>
			<Id>20674629</Id>
		</Link>
		<Link>
			<Id>20542260</Id>
		</Link>
		<Link>
			<Id>20533237</Id>
		</Link>
		<Link>
			<Id>20457774</Id>
		</Link>
		<Link>
			<Id>20016426</Id>
		</Link>
		<Link>
			<Id>19843737</Id>
		</Link>
		<Link>
			<Id>19777916</Id>
		</Link>
		<Link>
			<Id>19616724</Id>
		</Link>
		<Link>
			<Id>19524781</Id>
		</Link>
		<Link>
			<Id>19318006</Id>
		</Link>
		<Link>
			<Id>19306944</Id>
		</Link>
		<Link>
			<Id>19253206</Id>
		</Link>
		<Link>
			<Id>19132488</Id>
		</Link>
		<Link>
			<Id>18853843</Id>
		</Link>
		<Link>
			<Id>18774058</Id>
		</Link>
		<Link>
			<Id>18706783</Id>
		</Link>
		<Link>
			<Id>18625354</Id>
		</Link>
		<Link>
			<Id>18582671</Id>
		</Link>
		<Link>
			<Id>18554854</Id>
		</Link>
		<Link>
			<Id>18299362</Id>
		</Link>
		<Link>
			<Id>18279648</Id>
		</Link>
		<Link>
			<Id>18247070</Id>
		</Link>
		<Link>
			<Id>18021675</Id>
		</Link>
		<Link>
			<Id>17875143</Id>
		</Link>
		<Link>
			<Id>17875142</Id>
		</Link>
		<Link>
			<Id>17879696</Id>
		</Link>
		<Link>
			<Id>17674062</Id>
		</Link>
		<Link>
			<Id>17658095</Id>
		</Link>
		<Link>
			<Id>17602359</Id>
		</Link>
		<Link>
			<Id>17601500</Id>
		</Link>
		<Link>
			<Id>17543650</Id>
		</Link>
		<Link>
			<Id>17466477</Id>
		</Link>
		<Link>
			<Id>17464254</Id>
		</Link>
		<Link>
			<Id>17453494</Id>
		</Link>
		<Link>
			<Id>17429670</Id>
		</Link>
		<Link>
			<Id>17376366</Id>
		</Link>
		<Link>
			<Id>17354190</Id>
		</Link>
		<Link>
			<Id>17325998</Id>
		</Link>
		<Link>
			<Id>17320773</Id>
		</Link>
		<Link>
			<Id>17268692</Id>
		</Link>
		<Link>
			<Id>17259035</Id>
		</Link>
		<Link>
			<Id>17243036</Id>
		</Link>
		<Link>
			<Id>17193860</Id>
		</Link>
		<Link>
			<Id>17174054</Id>
		</Link>
		<Link>
			<Id>17157468</Id>
		</Link>
		<Link>
			<Id>17040637</Id>
		</Link>
		<Link>
			<Id>16999328</Id>
		</Link>
		<Link>
			<Id>16988291</Id>
		</Link>
		<Link>
			<Id>16580806</Id>
		</Link>
		<Link>
			<Id>16566645</Id>
		</Link>
		<Link>
			<Id>16552382</Id>
		</Link>
		<Link>
			<Id>16362812</Id>
		</Link>
		<Link>
			<Id>16357381</Id>
		</Link>
		<Link>
			<Id>16338316</Id>
		</Link>
		<Link>
			<Id>16133609</Id>
		</Link>
		<Link>
			<Id>16096604</Id>
		</Link>
		<Link>
			<Id>15788584</Id>
		</Link>
		<Link>
			<Id>15642291</Id>
		</Link>
		<Link>
			<Id>15635471</Id>
		</Link>
		<Link>
			<Id>15529836</Id>
		</Link>
		<Link>
			<Id>15505294</Id>
		</Link>
		<Link>
			<Id>15300544</Id>
		</Link>
		<Link>
			<Id>15279747</Id>
		</Link>
		<Link>
			<Id>15278705</Id>
		</Link>
		<Link>
			<Id>15236131</Id>
		</Link>
		<Link>
			<Id>15143223</Id>
		</Link>
		<Link>
			<Id>15141648</Id>
		</Link>
		<Link>
			<Id>15136027</Id>
		</Link>
		<Link>
			<Id>15094630</Id>
		</Link>
		<Link>
			<Id>15022983</Id>
		</Link>
		<Link>
			<Id>15008163</Id>
		</Link>
		<Link>
			<Id>14872380</Id>
		</Link>
		<Link>
			<Id>14702442</Id>
		</Link>
		<Link>
			<Id>14661668</Id>
		</Link>
		<Link>
			<Id>14661666</Id>
		</Link>
		<Link>
			<Id>14661663</Id>
		</Link>
		<Link>
			<Id>14661661</Id>
		</Link>
		<Link>
			<Id>14661306</Id>
		</Link>
		<Link>
			<Id>14650118</Id>
		</Link>
		<Link>
			<Id>14528718</Id>
		</Link>
		<Link>
			<Id>12949462</Id>
		</Link>
		<Link>
			<Id>12878072</Id>
		</Link>
		<Link>
			<Id>12876813</Id>
		</Link>
		<Link>
			<Id>12822521</Id>
		</Link>
		<Link>
			<Id>12744499</Id>
		</Link>
		<Link>
			<Id>12744498</Id>
		</Link>
		<Link>
			<Id>12733684</Id>
		</Link>
		<Link>
			<Id>12719915</Id>
		</Link>
		<Link>
			<Id>12592155</Id>
		</Link>
		<Link>
			<Id>12563154</Id>
		</Link>
		<Link>
			<Id>12361530</Id>
		</Link>
		<Link>
			<Id>12352163</Id>
		</Link>
		<Link>
			<Id>12242737</Id>
		</Link>
		<Link>
			<Id>12226761</Id>
		</Link>
		<Link>
			<Id>12164574</Id>
		</Link>
		<Link>
			<Id>11973504</Id>
		</Link>
		<Link>
			<Id>11973040</Id>
		</Link>
		<Link>
			<Id>11907356</Id>
		</Link>
		<Link>
			<Id>11868066</Id>
		</Link>
		<Link>
			<Id>11789473</Id>
		</Link>
		<Link>
			<Id>11781922</Id>
		</Link>
		<Link>
			<Id>11775722</Id>
		</Link>
		<Link>
			<Id>11762248</Id>
		</Link>
		<Link>
			<Id>11740602</Id>
		</Link>
		<Link>
			<Id>11702119</Id>
		</Link>
		<Link>
			<Id>11669077</Id>
		</Link>
		<Link>
			<Id>11578071</Id>
		</Link>
		<Link>
			<Id>11443295</Id>
		</Link>
		<Link>
			<Id>11409026</Id>
		</Link>
		<Link>
			<Id>11368937</Id>
		</Link>
		<Link>
			<Id>11329662</Id>
		</Link>
		<Link>
			<Id>11329658</Id>
		</Link>
		<Link>
			<Id>11329656</Id>
		</Link>
		<Link>
			<Id>11329655</Id>
		</Link>
		<Link>
			<Id>11329162</Id>
		</Link>
		<Link>
			<Id>11274884</Id>
		</Link>
		<Link>
			<Id>11218011</Id>
		</Link>
		<Link>
			<Id>11125632</Id>
		</Link>
		<Link>
			<Id>11027076</Id>
		</Link>
		<Link>
			<Id>11016058</Id>
		</Link>
		<Link>
			<Id>10803203</Id>
		</Link>
		<Link>
			<Id>10761553</Id>
		</Link>
		<Link>
			<Id>10749221</Id>
		</Link>
		<Link>
			<Id>10688065</Id>
		</Link>
		<Link>
			<Id>10688063</Id>
		</Link>
		<Link>
			<Id>10665303</Id>
		</Link>
		<Link>
			<Id>10575758</Id>
		</Link>
		<Link>
			<Id>10499712</Id>
		</Link>
		<Link>
			<Id>10499697</Id>
		</Link>
		<Link>
			<Id>10499696</Id>
		</Link>
		<Link>
			<Id>10475937</Id>
		</Link>
		<Link>
			<Id>10222521</Id>
		</Link>
		<Link>
			<Id>10222515</Id>
		</Link>
		<Link>
			<Id>10222514</Id>
		</Link>
		<Link>
			<Id>10051883</Id>
		</Link>
		<Link>
			<Id>10024396</Id>
		</Link>
		<Link>
			<Id>9847909</Id>
		</Link>
		<Link>
			<Id>9793138</Id>
		</Link>
		<Link>
			<Id>9757294</Id>
		</Link>
		<Link>
			<Id>9725288</Id>
		</Link>
		<Link>
			<Id>9658901</Id>
		</Link>
		<Link>
			<Id>9575723</Id>
		</Link>
		<Link>
			<Id>9510579</Id>
		</Link>
		<Link>
			<Id>9456947</Id>
		</Link>
		<Link>
			<Id>9391495</Id>
		</Link>
		<Link>
			<Id>9317094</Id>
		</Link>
		<Link>
			<Id>9314960</Id>
		</Link>
		<Link>
			<Id>9314959</Id>
		</Link>
		<Link>
			<Id>9269670</Id>
		</Link>
		<Link>
			<Id>9193407</Id>
		</Link>
		<Link>
			<Id>9125660</Id>
		</Link>
		<Link>
			<Id>9016217</Id>
		</Link>
		<Link>
			<Id>8976943</Id>
		</Link>
		<Link>
			<Id>8819381</Id>
		</Link>
		<Link>
			<Id>8855688</Id>
		</Link>
		<Link>
			<Id>8903064</Id>
		</Link>
		<Link>
			<Id>8903059</Id>
		</Link>
		<Link>
			<Id>8903058</Id>
		</Link>
		<Link>
			<Id>8599783</Id>
		</Link>
		<Link>
			<Id>8794574</Id>
		</Link>
		<Link>
			<Id>7892443</Id>
		</Link>
		<Link>
			<Id>8153333</Id>
		</Link>
		<Link>
			<Id>8290724</Id>
		</Link>
		<Link>
			<Id>8338105</Id>
		</Link>
		<Link>
			<Id>1481295</Id>
		</Link>
		<Link>
			<Id>1539132</Id>
		</Link>
		<Link>
			<Id>2047316</Id>
		</Link>
		<Link>
			<Id>1943587</Id>
		</Link>
		<Link>
			<Id>2222794</Id>
		</Link>
		<Link>
			<Id>2584497</Id>
		</Link>
		<Link>
			<Id>3288780</Id>
		</Link>
		<Link>
			<Id>3213296</Id>
		</Link>
		<Link>
			<Id>4058411</Id>
		</Link>
		<Link>
			<Id>3905087</Id>
		</Link>
		<Link>
			<Id>6482054</Id>
		</Link>
		<Link>
			<Id>6473764</Id>
		</Link>
		<Link>
			<Id>6217136</Id>
		</Link>
		<Link>
			<Id>7068417</Id>
		</Link>
		<Link>
			<Id>7326186</Id>
		</Link>
		<Link>
			<Id>6940010</Id>
		</Link>
		<Link>
			<Id>7330196</Id>
		</Link>
		<Link>
			<Id>7423836</Id>
		</Link>
		<Link>
			<Id>7415301</Id>
		</Link>
		<Link>
			<Id>7408592</Id>
		</Link>
		<Link>
			<Id>531835</Id>
		</Link>
		<Link>
			<Id>663071</Id>
		</Link>
		<Link>
			<Id>616459</Id>
		</Link>
		<Link>
			<Id>4818442</Id>
		</Link>
		<Link>
			<Id>4848922</Id>
		</Link>
		<Link>
			<Id>4808999</Id>
		</Link>
		<Link>
			<Id>5046513</Id>
		</Link>
		<Link>
			<Id>5512349</Id>
		</Link>
		<Link>
			<Id>6072516</Id>
		</Link>
		<Link>
			<Id>5594242</Id>
		</Link>
		<Link>
			<Id>5998281</Id>
		</Link>
	</LinkSetDb>
</LinkSet>
</eLinkResult>
