<?xml version="1.0"?>
<!DOCTYPE eLinkResult PUBLIC "-//NLM//DTD eLinkResult, 23 November 2010//EN" "http://www.ncbi.nlm.nih.gov/entrez/query/DTD/eLink_101123.dtd">
<eLinkResult>

	<LinkSet>
		<DbFrom>nuccore</DbFrom>
		<IdList>
			<Id>48819</Id>
			<Id>7140345</Id>
		</IdList>
		<LinkSetDb>
			<DbTo>protein</DbTo>
			<LinkName>nuccore_protein</LinkName>
			<Link>
				<Id>48820</Id>
			</Link>
		</LinkSetDb>
		<LinkSetDb>
			<DbTo>protein</DbTo>
			<LinkName>nuccore_protein_cds</LinkName>
			<Link>
				<Id>16950486</Id>
			</Link>
			<Link>
				<Id>16950485</Id>
			</Link>
			<Link>
				<Id>15145457</Id>
			</Link>
			<Link>
				<Id>15145456</Id>
			</Link>
			<Link>
				<Id>15145455</Id>
			</Link>
			<Link>
				<Id>7331953</Id>
			</Link>
			<Link>
				<Id>7331951</Id>
			</Link>
			<Link>
				<Id>7331950</Id>
			</Link>
			<Link>
				<Id>7331949</Id>
			</Link>
			<Link>
				<Id>7331948</Id>
			</Link>
			<Link>
				<Id>7331947</Id>
			</Link>
			<Link>
				<Id>7331946</Id>
			</Link>
			<Link>
				<Id>7331945</Id>
			</Link>
			<Link>
				<Id>7331944</Id>
			</Link>
			<Link>
				<Id>7331943</Id>
			</Link>
			<Link>
				<Id>48820</Id>
			</Link>
		</LinkSetDb>
	</LinkSet>
</eLinkResult>
